metric,value
Number of recurrence points,1276140746.0
The total number of lines in the recurrent plot (NRLINE),82152452.0
The average length of line structures (L),30.69328858254894
Shannon entropy: Shannon information entropy of line lengths longer than the minimum length (ENTR),7.6330071355646005
Entropy measure normalized by the number of lines observed in the plot (rENTR),9.291271227746922e-08
Recurrence rate (RR),0.640398376177079
Total number of diagonal lines having a minimum length,49431067.0
Total number of recurrence points that form diagonal lines having a minimum length,1258279028.0
Determinism (DET),0.9860033416721575
Average diagonal line length (L),25.45522717524993
Longest diagonal line length (L_max),44640.0
Entropy of diagonal lines (L_entr),3.772291740820723
Entropy of diagonal lines normalized by the number of diagonal lines observed in the plot (L_rentr),7.631418801501338e-08
Divergence (DIV),2.2401433691756272e-05
Average vertical line length (V),38.60624753506002
Total number of vertical lines having a minimum length,32721385.0
Total number of recurrence points that form vertical lines having a minimum length,1263249889.0
Laminarity (LAM),0.989898585998131
Trapping time (TT),38.606248482452685
Longest vertical line length (V_max),1156.0
Entropy of vertical lines (V_entr),3.8607153947438775
Entropy of vertical lines normalized by the number of vertical lines observed in the plot (V_rentr),1.1798753001267757e-07
Total number of white vertical lines having a minimum length,29892261.0
Total number of white points that form white vertical lines having a minimum length,29892261.0
Average white vertical line length (W),23.446721544415794
Longest white vertical line length (W_max),28858.0
Entropy of white vertical lines (W_entr),3.311168203392094
Entropy of white vertical lines normalized by the number of white vertical lines observed in the plot (W_rentr),1.1077008204204072e-07
Longest white vertical line length inverse (W_div),3.465243606625546e-05
Ratio determinism / recurrence rate (DET/RR),1.5396718329584178
Ratio laminarity / determinism (LAM/DET),1.003950538665891
